{
  "$schema": "https://json-schema.org/draft/2020-12/schema",
  "$id": "https://dice-skirmish.local/schema/card.schema.json",
  "title": "CardDefinition",
  "description": "One hand-card / ritual JSON document (src/server/content/cards/<card-id>.json). Every card has a forge region. Play uses at most one of effect, equipment, overload, or ritual — locked to type. Print (rulesText) is player-facing authority; structured regions are engine authority.",
  "type": "object",
  "additionalProperties": false,
  "required": ["id", "name", "type", "subtypes", "forge", "rulesText"],
  "properties": {
    "$schema": { "type": "string" },
    "id": { "$ref": "defs.schema.json#/$defs/cardId" },
    "name": { "type": "string", "minLength": 1 },
    "playCost": {
      "description": "Leftover pile header. Not the Meter a player spends to play the card. The play cost is meterCost plus exceptionalMeterCost when every legal play spends that exceptional cost.",
      "$ref": "defs.schema.json#/$defs/symbolRequirement"
    },
    "type": { "$ref": "defs.schema.json#/$defs/cardType" },
    "subtypes": {
      "description": "Modifiers after Modify or Response. A ritual region uses continuous or reaction. Instant subtype is retired. combat counts toward the response-combat deck cap and does not change resolution.",
      "type": "array",
      "uniqueItems": true,
      "items": { "$ref": "defs.schema.json#/$defs/cardSubtype" }
    },
    "forge": { "$ref": "defs.schema.json#/$defs/forgeRegion" },
    "forgeTags": {
      "description": "Tags that satisfy face forge restrictions (echo for Arcane Echo).",
      "type": "array",
      "minItems": 1,
      "uniqueItems": true,
      "items": { "const": "echo" }
    },
    "rulesText": {
      "type": "string",
      "description": "English effect-region print below \"or\". Empty string means forge-only (\"Does not have\"). Use KEYWORDS timing prefixes: On roll: [Mark 1 Toxin]."
    },
    "effect": {
      "description": "Instant / reaction one-shot. Absent when unimplemented, forge-only, or when the playable region is equipment / overload / ritual.",
      "$ref": "defs.schema.json#/$defs/effectRegion"
    },
    "equipment": {
      "description": "Required when type is equipment. mayTargetOpponent, optional creatureAttributes, abilities (standing triggers).",
      "$ref": "defs.schema.json#/$defs/equipmentRegion"
    },
    "overload": {
      "description": "Required when type is overload. Optional faceSymbols / faceKinds gates; onRoll (required, may be empty); optional onAbsorb.",
      "$ref": "defs.schema.json#/$defs/overloadRegion"
    },
    "ritual": {
      "description": "Required when type is ritual. activeWhen ([Active when]), spend ([Spend] on activate), effects (activate payload, may be empty), standingAbilities (continuous while ready).",
      "$ref": "defs.schema.json#/$defs/ritualRegion"
    },
    "fighterRestriction": {
      "description": "Spec 028. Legal only if this creature definition is in your living squad.",
      "$ref": "defs.schema.json#/$defs/creatureId"
    },
    "archetypeRestriction": {
      "type": "string",
      "minLength": 1,
      "description": "Spec 028. Legal if any living squad fighter's archetype matches."
    },
    "meterCost": {
      "type": "integer",
      "minimum": 1,
      "description": "Meter spent on every play. Part of the card's play cost. Omit when the play is free."
    },
    "seizesOffense": {
      "type": "boolean",
      "description": "Spec 030. Response that takes offensive control when it resolves against a waiting combat action. Does not cancel that action's damage."
    },
    "endsSequence": {
      "type": "boolean",
      "description": "Spec 030. When this link resolves and was not negated, the sequence ends and the turn passes."
    },
    "modifySubject": {
      "type": "string",
      "enum": ["roll", "die", "moveset", "target", "tag"],
      "description": "Spec 030. What a Modify acts on. Not a separate card type."
    },
    "addedTechnique": {
      "description": "Spec 030. Technique a Moveset card adds to the Active Fighter. Printed Techniques stay usable without the card.",
      "$ref": "defs.schema.json#/$defs/fighterTechniqueDefinition"
    },
    "replaceFaceId": {
      "description": "Spec 030. [Replace] writes this face onto the chosen slot of that Fighter's die.",
      "$ref": "defs.schema.json#/$defs/faceId"
    },
    "exceptionalMeterCost": {
      "type": "integer",
      "minimum": 1,
      "description": "Spec 030. Meter for exceptional mode only. Normal mode does not spend this. On a Tag Modify this is the play cost, so rules text does not repeat the spend. On a card that can also be played in a chain for free, leave the outside-chain Meter in rules text."
    },
    "lifecycle": {
      "type": "string",
      "enum": ["one-shot", "persistent"],
      "description": "Spec 030. Omit to derive: an equipment or overload region, or a continuous ritual region, stays in play. Other cards are one-shot."
    },
    "afterResolveZone": {
      "type": "string",
      "enum": ["deck", "hand", "graveyard", "equipment", "overload", "ritual"],
      "description": "Spec 030. One-shot destination after the card resolves. Omit to discard (graveyard)."
    },
    "exGate": {
      "description": "Spec 035. Sequence hit gate for playing this EX card.",
      "type": "object",
      "additionalProperties": false,
      "required": ["sequenceRole", "hitType"],
      "properties": {
        "sequenceRole": { "$ref": "defs.schema.json#/$defs/sequenceRole" },
        "hitType": { "$ref": "defs.schema.json#/$defs/hitType" },
        "hitStrength": { "$ref": "defs.schema.json#/$defs/hitStrength" }
      }
    },
    "exStrike": {
      "type": "integer",
      "minimum": 0,
      "description": "Spec 035. Strike damage applied when the EX body resolves."
    },
    "exReroll": {
      "description": "Spec 035. Reroll scope and count for the EX body.",
      "type": "object",
      "additionalProperties": false,
      "required": ["scope", "times"],
      "properties": {
        "scope": {
          "type": "string",
          "enum": ["restricted-fighter", "controller"]
        },
        "times": { "type": "integer", "minimum": 1 },
        "strikePerFaceId": { "$ref": "defs.schema.json#/$defs/faceId" },
        "strikePer": { "type": "integer", "minimum": 0 }
      }
    },
    "exAttackBan": {
      "type": "boolean",
      "description": "Spec 035. When true, the restricted Fighter cannot attack on the controller's next turn."
    },
    "exExtraActionPhase": {
      "type": "boolean",
      "description": "Spec 035. When true, queue an extra actions phase after the EX resolves."
    }
  },
  "allOf": [
    {
      "if": {
        "properties": { "equipment": { "type": "object" } },
        "required": ["equipment"]
      },
      "then": {
        "properties": {
          "effect": false,
          "overload": false,
          "ritual": false
        }
      }
    },
    {
      "if": {
        "properties": { "overload": { "type": "object" } },
        "required": ["overload"]
      },
      "then": {
        "properties": {
          "effect": false,
          "equipment": false,
          "ritual": false
        }
      }
    },
    {
      "if": {
        "properties": { "ritual": { "type": "object" } },
        "required": ["ritual"]
      },
      "then": {
        "properties": {
          "effect": false,
          "equipment": false,
          "overload": false
        }
      }
    }
  ]
}
