{
  "$schema": "../schema/card.schema.json",
  "id": "card-air-launcher",
  "name": "Air Launcher",
  "type": "modify",
  "subtypes": ["ex"],
  "lifecycle": "one-shot",
  "fighterRestriction": "creature-vega",
  "meterCost": 8,
  "exGate": {
    "sequenceRole": "finisher",
    "hitType": "kick"
  },
  "exStrike": 3,
  "exReroll": {
    "scope": "controller",
    "times": 1
  },
  "exExtraActionPhase": true,
  "rulesText": "Kick Finisher. [Strike 3]. Reroll your dice. Take an extra actions phase.",
  "forge": { "faces": 1, "target": "own-die" }
}
