{
  "$schema": "../schema/card.schema.json",
  "id": "card-call-out",
  "name": "Call Out",
  "type": "modify",
  "subtypes": [],
  "lifecycle": "one-shot",
  "modifySubject": "tag",
  "exceptionalMeterCost": 2,
  "rulesText": "[Tag in] a Reserve Fighter.",
  "forge": { "faces": 1, "target": "own-die" }
}
