{
  "$schema": "../schema/card.schema.json",
  "id": "card-shift",
  "name": "Shift",
  "type": "modify",
  "subtypes": ["combat"],
  "lifecycle": "one-shot",
  "modifySubject": "target",
  "rulesText": "[Redirect] that hit onto the Fighter you choose.",
  "forge": { "faces": 1, "target": "own-die" }
}
