{
  "$schema": "../schema/card.schema.json",
  "id": "card-open-manual",
  "name": "Open Manual",
  "type": "modify",
  "subtypes": [],
  "lifecycle": "persistent",
  "modifySubject": "moveset",
  "rulesText": "Adds a Technique to the Active Fighter. That Technique is not printed yet.",
  "forge": { "faces": 1, "target": "own-die" }
}
