{
  "$schema": "../schema/card.schema.json",
  "id": "card-brace",
  "name": "Brace",
  "type": "response",
  "subtypes": ["combat"],
  "lifecycle": "one-shot",
  "rulesText": "[Block 2].",
  "forge": { "faces": 1, "target": "own-die" },
  "effect": {
    "effects": [
      {
        "type": "reduce-damage",
        "amount": 2,
        "target": {
          "kind": "chain-attack-target"
        }
      }
    ]
  }
}